class,labels,cleaned_tweet,sentiment_score
0,negative,every bad bitch comes come mood swings swing,-0.8074
0,negative,taylor wack ass as bitch nigga,-0.8074
0,negative,great daquan got get pregnant gon na nigger grandbaby,-0.0516
0,negative,sneaky hoes hoe,-0.2263
0,negative,henny cups cup ice bitch froze,-0.5859
0,negative,nigga need money fuck bitch,-0.8074
0,negative,freaky ass as ready ass as hoes hoe,-0.7906
0,negative,hate boys boy keep chasing chase bitch treat like nigga,-0.5106
0,negative,every hoe nigga tryna save make turn good woman jus keep ignoring ignore texts text,0.2263
0,negative,happy birthday fag,0.1531
0,negative,fw grown hoes hoe,0.0
0,negative,im pretty sure bad bitch words word shawty dime,-0.4215
0,negative,happy birthday biggest big retard youre favorite retard though happy birthday nigs,0.5574
0,negative,dont text first dont text thats lonely single stupid bitch,-0.7261
0,negative,fag b,-0.4767
0,negative,internet make think bitches bitch actually not,-0.8271
0,negative,new year eve bitches bitch like nye drunkinlove beyonce,-0.7351
0,negative,loyal pussy forever bein better well bitch thats passed pass around,0.5106
0,negative,still blaming blame bush fucking fuck retard,-0.91
0,negative,hate ghetto bitches bitch passion,-0.8555
0,negative,whats wrong bitch,-0.7845
0,negative,k niggah u evem shmoke,0.0
0,negative,bruh really rocking rock toaster face lmaoooo prolly got get bitches bitch man,-0.8271
0,negative,lightup sketchers sketcher definition kick feet foot together watch bitches bitch flock sentence blinding bitches bitch yo,-0.9442
0,negative,oil said say sumthin bout oil bitch cookin,-0.5859
0,negative,one thing hoe ratchet hoe bitch please take seat gt,-0.1027
0,negative,bitch hella cranky today someone hand joint,-0.1531
0,negative,everytime go cracker barrel girl great tits tit seats seat waitress nope chick teeth,0.4939
0,negative,im faggot,-0.6597
0,negative,issue attorney town mean bitch next time get trouble,-0.7579
0,negative,k shut hoe,0.0
0,negative,chris faggot,-0.6597
0,negative,hey liberals liberal meet future majority leader us u senate enjoy payback bitch p stoprush waar,-0.1531
0,negative,nice account faggot,-0.3818
0,negative,facebook needs need buttons button dislike cares care retarded retard,-0.5423
0,negative,hey always go sometimes three crazy bitches bitch one suave mfer trick going go,-0.8074
0,negative,bro moves move hoe moves move,0.0
0,negative,shit pretty bitch momma anyone get drama,-0.6369
0,negative,bae win get pussy tonight shiiiiiit,0.5859
0,negative,tryna like steez bro got get dem hoes hoe rir,0.3612
0,negative,ight nigga haha fucking fuck queer clear schedule,0.2732
0,negative,get beauty scar tough guy eating eat pussy scarface,0.5106
0,negative,like k gold rillos pussy,0.3612
0,negative,take bitch ever really,-0.5859
0,negative,sterling cunt point simply everyone privately taped conversations conversation released release shut fuck,-0.7717
0,negative,chest kobe getting get docked k calling call ref faggot co,-0.6597
0,negative,expect total bitch towards yet,-0.5859
0,negative,gator bitches bitch best usin jimmy,-0.5423
0,negative,real nigs uck give uck,0.0
0,negative,good luck coming come see us u vegas vega bitches bitch,-0.4215
0,negative,yo bitch bitch gone go let fuck tonight thursty thursday wesgod cave,-0.9022
0,negative,fuck hoes hoe bigger big problems problem like ever cook house lmao,-0.3612
0,negative,got get ta bitch suck dick till nut spit gut slurp shit back slut,-0.9545
0,negative,ima whoop boy nothing bean head ass as bitch,-0.2382
0,negative,literally laughing laugh shock amazement joy everything everything pop champagne american queers queer arrived arrive,0.9287
0,negative,random kids kid sit plaza day shitty cars car faggots faggot,-0.9217
0,negative,dodging dodge hoes hoe like,0.2732
0,negative,bitches bitch th grade talking talk miss bae naw bitch missed miss graduation,-0.9423
0,negative,fucked fuck bitch fw talk hoes hoe claim fw funny,-0.8689
0,negative,u nigga idea random jiggas knowing know name work smh,-0.3182
0,negative,trash eating eat trash,0.0
0,negative,welcome dallas nawfside texas come hoe shit nigga texas get murdered murder,-0.8934
0,negative,niggers nigger really believe phelps smokin regular huh tell amp log night,-0.6486
0,negative,bitch made make dudes dude actin bitch made make,-0.8225
0,negative,undesirables undesirable bitches bitch big bruh,-0.891
0,negative,every cartoon alway saving save hoes hoe lmao lmao damn captain saveahoe,0.8519
0,negative,cant bitch make mad nigga already,0.6908
0,negative,smoke would not smokin hoes hoe less gettin fucked fuck,-0.8104
0,negative,asks get done do fucking fuck hoe,-0.5423
0,negative,think change doctor advocate cunt goes go mental hmm,-0.4939
0,negative,fuk wit real nicca,0.0
0,negative,commence carpet bombing iraq soldiers soldier video executed execute jihadis tunis,0.0
0,negative,nite bitches bitch,-0.8271
0,negative,already know trash tatted tat list things thing want nigga top,0.2732
0,negative,lol get eden bitches bitch fat,-0.7096
0,negative,jk would bitch got get done do,-0.4404
0,negative,spray clorox seat bitches bitch use much trust females female since sam rothstein met ginger,-0.6597
0,negative,seem like cory talked talk indianapolis hoes hoe nbs nb,0.3612
0,negative,wrong bitches bitch fuck nigga,-0.936
0,negative,understand many americans american hate obama saluting salute latte nobody tells tell swagfags anything abo,-0.5719
0,negative,stop looking look us u go eat pussy yuppie fucks fuck,-0.8316
0,negative,called call hoe lol,0.4215
0,negative,trying try run game u dumb bitch tho,-0.7964
0,negative,yo bitch gaggin jet laggin,-0.5859
0,negative,real hoe never let turn house wife let know start catching catch fe,0.0
0,negative,im south side niggah fuck around fuck around,-0.7906
0,negative,mindless twat shitting shit hiphop hahahaha,-0.9287
0,negative,women woman would put little love long man money gross bitches bitch broke abus,-0.8655
0,negative,niggas nigga act like straight bitches bitch,-0.7717
0,negative,beat bitch seriously bitch,-0.8519
0,negative,woman cares care get mad little things thing handle deserve hoe,0.4588
0,negative,rt see watch finna hit hoe put,0.0
0,negative,chill ever become president imma ban henny america day see negroes negro panic gotcha bitch,-0.8934
0,negative,twitter bitch selling sell chokers choker,-0.5859
0,negative,nigga gone go nigga im sorry amp hoe gone go hoe regardless,-0.0772
0,negative,get bitches bitch take care mos mo overrated overrate album released release last years year,-0.6705
0,negative,bet nigga got get charged charge murder tha intro gucci vs v guwop cause straight killed kill hoe freegucci freeradric,-0.9413
0,negative,females female never understand guys guy dont give af females female dont like liking like stop trippin dont know hoe,-0.7703
0,negative,hell believe lol still look good smaller small half hoes hoe,0.0258
0,negative,trashiest really ghetto girls girl always get likes like comments comment insta boys boy pictures picture,0.6486
0,negative,hate upload pic caption says say son someone asks omg son bitch found outside,-0.8176
0,negative,hell would freeze ever let bitch kick fuckin face,-0.8481
0,negative,lol naw bitch sociopath,-0.25
0,negative,ladies lady pop pussy like,0.3612
0,negative,know yo name way meet dat bitch eatta,-0.5859
0,negative,beyonce made make many hoodrat anthems anthem not hoe point life,0.0
0,negative,lol need halloween dress like ho know everyday another opportunity,0.7964
0,negative,ratchet bitch would,-0.5859
0,negative,trusted trust queer cakes cake wheres passion made make dammit,0.8555
0,negative,got get ta remind put da phone sometimes cuz get sidetracked sidetrack see bad bitches bitch n den get mad cuz cant meet em,-0.9371
0,negative,shot another monkey lmaooooooooooo,0.0
0,negative,voice behind mustard beat hoe,0.0
0,negative,lets let hangout monday nigs,0.0
0,negative,look like stop talking talk fucking fuck bitches bitch,-0.8979
0,negative,knocked knock bitch soul body lol,-0.25
0,negative,dutch people live outside newyorkcity white trash,0.0
0,negative,dollar every time someone called call maggie make rain hoes hoe,0.0
0,negative,unhappy scrappy got get pataki bitches bitch say tacky daddy range look like laffy taffy,-0.8402
0,negative,shut fuck dumb bitch,-0.891
0,negative,least nearly two decades decade complete trash put atysyc redeem,0.0
0,negative,weeknd bitches bitch love dark skin fellas fella,-0.5423
0,negative,clearly stating state masses mass pussy shared share girl send dat pussy shark,0.743
0,negative,bitches bitch shout momz cali keep doin u loveit,-0.8271
0,negative,bitches bitch love beefing beef nigga always bitches bitch faces face,-0.9042
0,negative,fuck nigga shit olivia pussy got get fitz going go batshit,-0.7964
0,negative,white bitch tried try set racial war lol bitch impossible smarter,-0.7717
0,negative,wake stoopid dyke,0.0
0,negative,bitch tryna say,-0.5859
0,negative,bitch nigga type never fight,-0.3851
0,negative,dis bitch,-0.5859
0,negative,get rid easily bitch,-0.34
0,negative,wallofthewasatch bitch,-0.5859
0,negative,got get bitch set like jada picket queen latifah riding rid round nieces niece bitch titi,-0.7269
0,negative,suck ass as bum ass as yankees yankee foh,-0.872
0,negative,say want nigga like bitch mad cause wifey,-0.6369
0,negative,throw throat thursdays thursday make ghetto gaggler,0.0
0,negative,hoodie little bitch last time heard hoodies team mike put hi,-0.5434
0,negative,bummy hoes hoe ur right sis si splash peppermint soap shit necessary,-0.5574
0,negative,lmfaoooo bitch change much could find,-0.5859
0,negative,understand mad making make track spoke volumes volume muthafuckas hoe amp bitch tracks track females female,-0.7906
0,negative,made make hey short cut pussy lips lip ann phone,-0.2732
0,negative,pussy ass as schedule,-0.5423
0,negative,porch monkey life,0.0
0,negative,bitch crying cry,-0.875
0,negative,sleeping sleep mom past weeks week swear bitch sex dreams dream something always moaning moan sleep,-0.3182
0,negative,damn coach never called call back bitch ass as,-0.875
0,negative,hell nah bitch,-0.8689
0,negative,niggas nigga bitches bitch hoes hoe bitches bitch ion see difference,-0.9571
0,negative,god send retards retard hell,-0.7845
0,negative,yo daddy bitch jus son boyyy,-0.5859
0,negative,right bitches bitch smh,-0.875
0,negative,slut hoe thot whore,-0.8442
0,negative,fuck hoe ass as professor looks look like extra halloween town,-0.6705
0,negative,damn knew whole time angry negro dude,-0.7184
0,negative,intimidated intimidate pussies pussy see sweet honest woman seriously could make stalking stalk thing much easier easy,0.765
0,negative,ppl talk bad ghetto hood kid growing grow nigga funnnnnnn,-0.4215
0,negative,dam got get ta hope niggah dont snitch,0.4404
0,negative,fucking fuck hate bitch much wan na smack face tongue kiss,-0.8481
0,negative,nigga watching watch love hiphop instead playoffs playoff gay denna bitch,0.1027
0,negative,fight den hoe,-0.3818
0,negative,tarzan dis hoe,0.0
0,negative,u say blessed bless u r hashtag lying lie r probably unhappy w ur life fake bitches bitch lolz,-0.765
0,negative,chink ass as eyes eye,-0.5423
0,negative,yall ever car ya moma singing sing every song come like bitch know sch,-0.3182
0,negative,home one hoe katrina,0.0
0,negative,got get cramps cramp bitches bitch smokeweed teamloudpack,-0.8591
0,negative,trust hoes hoe lol na bigger big us u think bc guys guy talk girls girl first understand,0.7269
0,negative,hoe year round yeezy taught,0.0
0,negative,bae lem me see phone dont hella hoes hoe one sec,0.0
0,negative,fucking fuck bitches bitch ya using use pus pu hook u,-0.9231
0,negative,lord please get ghetto ass as hospital,-0.296
0,negative,birds bird wedlock rate white fathers father running run away,0.0
0,negative,ayo twat boy got get ta new phone give yo jack,-0.6597
0,negative,love say bitch,0.1027
0,negative,everybody pregnant bitches bitch waste time,-0.8885
0,negative,instagram place find thirsty hoes hoe connects time,0.0
0,negative,wiz warrant like bitch,-0.3182
0,negative,eyebrows eyebrow like wall street homes home bitches bitch wilding pencil,-0.7351
0,negative,hoes hoe gone go hoes hoe dontbemad,0.0
0,negative,action probably get bitch,-0.5859
0,negative,called call least times time make hair appointment bitches bitch pick guess stop make appointment grrr,-0.8834
0,negative,fat trel niggah,0.0
0,negative,fat bitch turnt ice cream not gon lie would,-0.5859
0,negative,lmao bitch dumb slap,-0.3818
0,negative,know ex bitch think got get next fucced gang niggas nigga threw pussy dec,-0.7351
0,negative,told mom eats cereal ugly amp gon say rude little bitch thought let bitch know,-0.9234
0,negative,hating hat girl tho wish bitch hating hat song go,-0.8271
0,negative,yeah eyebrows eyebrow point ya pussy clean,0.5994
0,negative,raspy ass as voice annoying annoy bitch,-0.9169
0,negative,grab bitches bitch u lmao oh belt fendi,-0.5859
0,negative,new years year ever get bitch loaded load gfu,-0.5859
0,negative,love hoe hahahhaa uglyass,0.6369
0,negative,nigga drinking gatorade like not dumass dumas hot lol bitch drink water,0.128
0,negative,lmao fight know ghetto ass as school dude highly doubt since give fuck,-0.8173
0,negative,stand ex let go like bitch get life nobody stuntin yo ass as,-0.7003
0,negative,still see niggers nigger see white hoes hoe,-0.6486
0,negative,bitch touch,-0.5859
0,negative,wet amp warm pussy,0.2263
0,negative,smh hoes hoe like fucking fuck actual loyal girls girl smh,-0.3612
0,negative,older old black guy factory know none coons coon work tipped right,0.0
0,negative,sucks suck bitch cant even pretend dance,-0.8361
0,negative,thottie yous thottie thottie yous thottie yes bitch womp womp lord save parched parch hoes hoe,0.2732
0,negative,hoes hoe getting get outta hand,0.4939
0,negative,sleep curve really bitch u slept pm huh smh,-0.7501
0,negative,rude talk fat bitches bitch cool talk skinny bitches bitch cus cu know alot thick hoes hoe ver,-0.9524
0,negative,kevin gates gate said say real niggas nigga eat booty real niggas nigga please bitches bitch ion get tieddd,-0.8807
0,negative,bring girl around nobody leo niggah know mess,-0.3612
0,negative,go insult always call someone fat ugly hoe,-0.765
0,negative,ayo da hell nobody hip niccas betterlatethannever,-0.6808
0,negative,porn android iphone ipad sex xxx closeup squirting squirt pussy fingered finger asshole,0.0
0,negative,hoe crying cry mugshot bruh,-0.7351
0,negative,beach bitch,-0.5859
0,negative,kill cops cop cracker babies baby next black states state white states state latino states state moving move backwards,-0.6908
0,negative,real niggas nigga handle anything including include bitch nigga,-0.7351
0,negative,hitman holla vs v charlie clips clip match bittersweet shit gon na cold cus cu hitman holla gon na work last battle,-0.7579
0,negative,pussy put yo ass as sleep calling call nyquil,-0.5423
0,negative,trust nigga fear bitch,-0.5719
0,negative,god yall hoes hoe better well get twitter,0.7269
0,negative,everybody entitled entitle opinion tho not bitch need shut amp sit fuck,0.171
0,negative,like play bitch,0.0258
0,negative,liberty justice go get sandwich nigger kill,-0.4939
0,negative,hoe leaving leave man house right costume,-0.0516
0,negative,bae dodges dodge hoes hoe cause want,0.0772
0,negative,hoes hoe got get bodies body cemetery,0.0
0,negative,st show proof sold sell pussy wait,0.0
0,negative,oh shut faggot get disease overused overuse twitter,-0.6597
0,negative,take bitch recieve head mom,-0.5859
0,negative,wow fucking fuck lame laughing laugh ya hey fat ass as u want twinkie u said say made make sense go eat something,0.2732
0,negative,quote tweet funniest pic ya camera roll bitch started start,-0.0516
0,negative,not weird faggot,0.6167
0,negative,okay either super dyke weird car sex fetish,0.6249
0,negative,hoe gave give head say turn,0.0
0,negative,account incredibly retarded retard,-0.8258
0,negative,know hoe believe astrology ima make sign,0.0
0,negative,happen vixen ent bitches bitch got get ran threw side like foothill bitch,-0.875
0,negative,hoes hoe lie,0.0
0,negative,nonexistent hoes hoe,0.0
0,negative,like wassup bitch huh nothing thought hoe lt,-0.3182
0,negative,look fucking fuck retarded retard alls pants pant ankles ankle,-0.891
0,negative,getting get blocked block faggot,-0.8555
0,negative,gettin bitches bitch never hard settled settle cause start got get corny girl thurl,-0.8128
0,negative,ow amp gone go big lanky twat,-0.6597
0,negative,omg go charlie bear twerk team fucks fuck,-0.765
0,negative,nappy headed head hoes hoe call anyone ugly stop embarrassing embarrass pls,-0.8402
0,negative,look benz bitch shit,-0.8126
0,negative,mine say intimidator cause bitches bitch handle,-0.8834
0,negative,not prettier amber pussy pretty,0.1645
0,negative,lol maybe give nd date hoes hoe dates date let know work lol,0.6808
0,negative,gang gang bitch,-0.5859
0,negative,khaye see freakin emojis basic bitch today,-0.5859
0,negative,people bitch ass as niggas nigga amp stay far away,-0.8658
0,negative,rebelscience using use actual woman genetic engineering lab natural clones clone something faggot rome,-0.4404
0,negative,st charlotte goon niccas gon fkkk around burn bank america stadium,0.0
0,negative,pistols pistol bad bitches bitch hustlers hustler bad business,-0.9403
0,negative,bamoose prophet right thy hoes hoe loyal,0.4767
0,negative,hit women woman slap tf bitch close fisted business though cowardly shit,-0.8555
0,negative,dog bitches bitch bt king ya queen,-0.8271
0,negative,miss britt god damn bitch real nigga baby,-0.7184
0,negative,feel alone miss wife much hate white trash raped rap killed kill daughters daughter,-0.9686
0,negative,smashed smash werewolf chick thought related felt guilty later discovered discover know ho,-0.4215
0,negative,porn android iphone ipad sex xxx fisting lovely sounds sound fisting loose pussy,0.3612
0,negative,remember watch cooties cootie stay away hoe herpes,0.0
0,negative,excited excite hang bitches bitch,-0.4939
0,negative,hoes hoe hoes hoe nothin hoes hoe,0.0
0,negative,whatta fags fag doin,-0.4767
0,negative,porn android iphone ipad sex xxx lesbian lesbian girl eating eat pussy,0.0
0,negative,bih stay ghetto ass as neighborhood,-0.5423
0,negative,bitches bitch give virus,-0.8271
0,negative,bitches bitch get bat sumn ak voice,-0.8271
0,negative,dis bitch jus blew high,-0.5859
0,negative,ima start friend zoning zone hoes hoe,0.4939
0,negative,crafty bitches bitch best way cheat test,-0.7579
0,negative,everyday turn cold heartless bitch,-0.7906
0,negative,makeup saving save alot bitches bitch single,-0.6705
0,negative,hours hour hell obama flat lied lie get reelected reelect killery lt diff make karma bitch,-0.9001
0,negative,pulled pull coco ratchet way home yes bitch,-0.2732
0,negative,teairri marie crazy poor girl anything bitter ass as bird,-0.8957
0,negative,go direct flight price done do layovers layover flying fly bitch enough,-0.5859
0,negative,bitch retweet shit lol love hope great bday,0.765
0,negative,follow dog k bitches bitch made make golden retriever bitch today park,-0.91
0,negative,right far im concerned bitch tf,-0.5859
0,negative,going go miss bitches bitch much far right resting rest ol girl booty funny shit,-0.875
0,negative,amen overall bitches bitch better well stop stupid cause yall hoes hoe stupider ya realize,-0.9153
0,negative,maybe yall hoe ass as niggas nigga start considering consider girls girl feelings feeling shiii think nigga,-0.6597
0,negative,nigs haters hater man made make easy luv,-0.4767
0,negative,hard real nigga niggas nigga got get bitch tendencies tendency,-0.765
0,negative,oh hell yeah lol know nicca injury prone,-0.5267
0,negative,used use send bitch,-0.5859
0,negative,bitch comes come hope bout slick shit yapping yap thuggin,-0.6705
0,negative,lmfao wtf kinda pussy mom think got get buying shit,-0.5994
0,negative,mans man birthday big booty bitches bitch show love,-0.5423
0,negative,trash guess got get tired tire chalmers trash starting start chalmers lose job norris cole lmfaoooo,-0.6808
0,negative,scandal negro bed wench fairy tale propaganda via must see hebrew daughters daughter zion,-0.5994
0,negative,hoes hoe loyallll,0.0
0,negative,bitch ass as people first call someone bitch,-0.9022
0,negative,hey shawnda rich bitch,-0.0516
0,negative,acting act like bitch bitch problem,-0.8316
0,negative,bitch song ifihadme,-0.5859
0,negative,pisses piss much brett screams scream fag whore window people,-0.9468
0,negative,told dad go buy cookies cooky graduation reception nigga bought oreos oreo,0.0
0,negative,bitch bad lookin like bag laundry,-0.7003
0,negative,ppl really handle girl not yes girl says say feel come bitch,-0.7234
0,negative,well cunt suck ass as,-0.8176
0,negative,long gon feed pussy get munchies,0.0
0,negative,already tired tire mr stupid af decides show us u video trigonometric notions notion um yeah wanted want say hoe,-0.5859
0,negative,would followed follow george washington means mean white trash,0.0
0,negative,men say afraid daughters daughter bc want turn hoes hoe w e,0.0772
0,negative,ya pussy rap sheet whole lot bros,0.0
0,negative,frfr come party wimmie leavin shithole til summfest leavin dis hoe,0.4019
0,negative,bitch taught know mess ups,-0.743
0,negative,cunt still talking talk holy fuck get breast cancer already,-0.9022
0,negative,stupid bitch,-0.802
0,negative,beat pussy like nemesis,0.3612
0,negative,beautiful bride tell erica congrats remembers nig,0.8074
0,negative,nicca said say imma slap ya daddy den put em n da yo still nigga aint,0.1531
0,negative,ask around n streets street bitch bout jay,-0.5859
0,negative,feminism think men women woman equal bitch know shit feminism,-0.8126
0,negative,big booty bitches bitch ass as tits tit,-0.9201
0,negative,lmao hoes hoe days day,0.5994
0,negative,know bitch boy named name luke,-0.5859
0,negative,dare insult pearl harbor vet dumb cunt,-0.8689
0,negative,bitches bitch better well stop madness,-0.8316
0,negative,girls girl fucking fuck retarded retard back started start cramping cramp man double,-0.9081
0,negative,time chasing chase someone like turning turn wine coolers cooler look like bitch really think lol,0.507
0,negative,im ice cube u call grinch got get ur list aint giving give u shit bitch,-0.4427
0,negative,brony folk far wide throwing throw bitch fits fit equestriagirls must one looks look interesting interest,0.5267
0,negative,iggy wan na black bad ur white widow hoe,-0.5423
0,negative,ead especially rita died die dexter trash breaking break bad,-0.9108
0,negative,bad hes he faggot,-0.836
0,negative,dat dawg live betta den colored color folk hood,0.0
0,negative,remembers dick lol wants want recommend shoot bitch show might snap,-0.5994
0,negative,many lil niggas nigga tl boosie got get hoes hoe,-0.34
0,negative,nigga fire nina like first day job bitch slept,-0.5719
0,negative,ion fb niggas nigga twitter worried amp ig nigga foe everybody try bffl got get hoes hoe,-0.7579
0,negative,buddy slapped slap rent stress messy bitch done do told u hoes hoe bout new york niggas nigga amp temper trainvideo,-0.9136
0,negative,redneck land tennessee,0.0
0,negative,big long lost lose brother swear know without wetback,-0.6369
0,negative,faggot,-0.6597
0,negative,tell side bitch family business none business,-0.5859
0,negative,liked like one bitch always shit causing cause fucking fuck drama,-0.765
0,negative,damn bad thing side hoes hoe get mad hit day,-0.8555
0,negative,oh sneaky son bitch,-0.6908
0,negative,smurf real cat bitch,-0.5859
0,negative,done do wit cheer team bitches bitch literally brain dead,-0.8658
0,negative,r u ugly ur avi bitch,-0.7964
0,negative,still put pride front feelings feeling yes bitch still childish,-0.1027
0,negative,hate twitter bunch sexy bitches bitch,-0.8402
0,negative,want fag,-0.4215
0,negative,tryna get bitches bitch linkedin,-0.8271
0,negative,realize sent message wife instead side hoe,0.0
0,negative,found marehood code horse pussy brony mlp,0.0
0,negative,thought love bitch core,0.1027
0,negative,ugly bitches bitch like argue lot,-0.8979
0,negative,god bless dumb niggas nigga trust hoes hoe,0.3612
0,negative,favorite line far blind must suck ever asshole made make ho,-0.3818
0,negative,pussy,0.0
0,negative,freshman fucked fuck boys boy senior class hoe notcute,-0.836
0,negative,told little bitch ass as nigga look like eat gun charge slap hoe ass as lawyer,-0.85
0,negative,easy bitch lmfaoooooooooo girl,-0.2263
0,negative,heres here thought dont valentine bc mean ugly bitch haha,-0.6249
0,negative,ratchet lol ass as lol bitch,-0.4019
0,negative,black bitches bitch drive fav song come pt golilstacy,-0.6908
0,negative,tonight got get ta take dope ass as picture wit bad bitch drunk change avi tired tire seeing see one already,-0.9442
0,negative,fags fag say swag shits shit mad retarded retard,-0.9643
0,negative,tf baby goal bitch u gone go gone go baby goals goal,-0.5859
0,negative,word ray rice marry gone go divorces divorce bitch way outta box handcuffs handcuff,-0.5859
0,negative,pussy bomb call dynamite,-0.3612
0,negative,soon left iraq towel heads head think fucking fuck barge take worked work hard set pisses piss,-0.8402
0,negative,awkward moment changing change gym penis head slips slip slit boxers boxer,-0.1531
0,negative,pull ex make bitch mad,-0.7906
0,negative,take like tamu bitches bitch jumped beating sc good,-0.743
0,negative,hoes hoe acting act amp know imma let em,0.0
0,negative,ooo logan pulling pull bitches bitch,-0.8271
0,negative,still ugly hoe still look like muffie arthur,-0.2023
0,negative,fun games game slap bitch,0.0258
0,negative,sometimes u got get ta knock nicca tho ijs freecb,0.1779
0,negative,wonder philly fans fan aware complete cunts cunt aware ok,-0.5574
0,negative,bitch like laugh joke,0.5423
