class,labels,cleaned_tweet,sentiment_score
1,positive,want oreos oreo help,0.4588
1,positive,want cowboy killer,-0.6124
1,positive,want four loco right chug go straight sleep,0.296
1,positive,want slope job get away everything two weeks week hate around people unless friends friend,0.4404
1,positive,want cookies cooky brownies brownie ice cream,0.0772
1,positive,want monkey bread,0.0772
1,positive,want go pumpkin patch love birds bird make date rest us u uncomfortable,0.4404
1,positive,accused accuse never taking take full front face shot one slant angle nothing,-0.4588
1,positive,flying fly slope rammed ram small asian boy kid got get like champ walked walk,0.6808
1,positive,love charlie,0.6369
1,positive,informed inform bird pheonix today could not find physical image paintings painting mythological extinct,0.0
1,positive,told never fold amp never sell sole,0.0
1,positive,went go outside got get mad bc weather trash,-0.4939
1,positive,went go see leave movie theater tables table real food fun ordered order brownie dessert p,0.4767
1,positive,wept thurmanmunson died die weep years year later captain yankees yankee,-0.9349
1,positive,wonder many yankee fans fan hurt derek jeter star break lmao,0.4215
1,positive,would bitch weather bipolar gon na appreciate nice instead,0.1779
1,positive,would describe work blaxican,0.0
1,positive,would like test see long tongue really lady eggplant emoji,0.3612
1,positive,would went go ref hell post game interview saying say called call sad trash,-0.8271
1,positive,best owning own bird could teach funniest things thing say,0.8316
1,positive,anything oreo vanilla bean drink dunkin amp chocolate chip muffin starving starve amp sounds sound good,-0.4215
1,positive,kill meet charlie sheen,-0.6908
1,positive,rather follow girls girl instagram rather bird brain tweets tweet tl,0.0
1,positive,rather hear neal degrasse tyson tell scientific mistakes mistake assumptions assumption wasp,-0.5994
1,positive,yankee fan forever,0.3182
1,positive,give baby zebra girl,0.0
1,positive,let u clam top let dat nookie pop dat cookie jar rookie girllll,0.2023
1,positive,still eat animal crackers cracker emabiggestfans,0.0
1,positive,camera shy talk phones phone love rain youn kno life understand,0.4939
1,positive,hun gry,0.0
1,positive,pregnant charlie brown worstpeanutsspecialever,0.0
1,positive,redneck without homophobia racism,0.5096
1,positive,sucker colored color eyes eye,-0.5267
1,positive,post charlie clips clip vs v yung ill rap battle review,-0.6597
1,positive,year old gay driving drive back roads road redneck virginia blasting cheetah girls girl scream sitcom,-0.4019
1,positive,definitely watching watch mook lux battle today damn,-0.3818
1,positive,finna see yankees yankee win baseball game,0.5859
1,positive,getting get sleepy phone acting act retarded retard,-0.7964
1,positive,going go dress trash halloween oh wait look like everyday,0.3612
1,positive,gon na ghetto color stain sharpie ctfu,0.0
1,positive,hooked monkey phonics,0.0
1,positive,bed like half asleep stuff really want oreo coffee coolatta,0.4754
1,positive,jus trill nicca mane,0.0
1,positive,sitting sit waiting wait twitter explode yankees yankee game ends end,0.0
1,positive,tryna get sleep birds bird start getting get rowdy,0.0
1,positive,making make pollo la brasso today,0.0
1,positive,not big uncle tom slur anyway least reserve earn not dare not vote dem,0.0
1,positive,not ghetto,0.0
1,positive,not really phone kinda guy actually hate talking talk phone amp texting kinda trash also,-0.5325
1,positive,okay rasor talking talk trash,0.2263
1,positive,retard sometimes,-0.5267
1,positive,biggest big redskins redskin dam right get stop,-0.296
1,positive,got get birds bird eye view secrets secret keep,0.0
1,positive,got get saltine crackers cracker red wine possible diy communion uh church awhile tbtweets,0.0
1,positive,never twinkie,0.0
1,positive,pretty much eaten eat entire box nephew cheese nips nip feel bad little,-0.0772
1,positive,seen see majorleauge charlie sheen giants giant committed commit sin worshipped worship barrybonds batting coach gt,0.7717
1,positive,one welcome new eastern panhandle overlords overlord hope better well job yokels yokel got get us u first place,0.872
1,positive,isis isi jihadis discuss discus buying selling sell yezidi girls girl slaves slave tcot pjnet,0.0
1,positive,isis isi jihadis australia shoot man face chanting chant isis isi stay tcot pjnet,-0.34
1,positive,isis isi supporters supporter america jihadis next door,0.6124
1,positive,idiotic censorship drive france president fails understand empowering empower jihadis censoring censor internet wholesale fail,-0.9169
1,positive,ashton trash make come guys guy someone like ashton trash makes make many people smile,0.6124
1,positive,ever committ crime cite lvl sole influence,-0.5423
1,positive,kid today michelle obama lunch would wind trash,0.0
1,positive,legit trying try worst bad thing try play games game get bird sooo fast,-0.7351
1,positive,temple beats beat rutgers today happy clam,0.5719
1,positive,anyone wants want bring sweet tea party make bday perfect well cracker barrel,0.8957
1,positive,ever sports sport seemed seem scripted script ending end yankee game proved prove,0.0
1,positive,yankee fan probably would sf giants giant fan lol,0.7506
1,positive,dated date girl lived live mack road could get holy trinity sacramento ghettos ghetto daily basis,0.0
1,positive,someone pushes push hard today may surprised ho capricorn,0.128
1,positive,get dempster look like getting get older old smh bring youth mlb,0.0516
1,positive,yankees yankee beat red sox even deserve playoffs playoff yankees yankee redsox mlb,0.0
1,positive,crust graham cracker keep pie,0.0
1,positive,train officers officer wearing wear body armor stand back watch smoke clear every gun ho wan na,0.0516
1,positive,hoe ima treat like one like good girl ima treat like one discriminate,0.93
1,positive,descended descend anything less european nobility royalty non titled title common gutter trash,0.0
1,positive,tattoos tattoo diversion bird chest malnourished malnourish body sir instagram would trash,0.0
1,positive,enjoy hunting hunt sport trash hunt food deserve starve,0.0772
1,positive,must call cracker please call cheez not saltine,0.3182
1,positive,think term redskins redskin offensive political issue ignorant,-0.6249
1,positive,not directly descended descend european royalty upper nobility not fully human common gutter trash,0.0
1,positive,ever drunk fish might redneck,-0.34
1,positive,iggy trending trend twitter trash today,0.0
1,positive,igot level far flappy birds bird smh,-0.3182
1,positive,im twat,-0.6597
1,positive,im glad met chick reminds trash left behind,0.4588
1,positive,im mickey ds d gone go ask double cheese burger wit cheese foh,0.0
1,positive,im ready today iu iubb hoosiers hoosier hoosierstate ncaa big michigan gameday btown,0.3612
1,positive,im telling tell man roethlisberger got get record expunged expunge became become trash,0.0
1,positive,ima trash fantasy,0.0
1,positive,n like sunshine blue sky song bird smile front porch perfume ocean wind kissed kiss cheeks cheek,0.9118
1,positive,inbed eating eat left poppadom livinthedream,0.0
1,positive,indiana lost lose bowling green big ten continues continue trash,-0.6124
1,positive,inspiring inspire huge crowd tourists tourist sit watch wild meadow rats rat trash cans can cameras camera gasping gasp,0.8316
1,positive,international law enforcement operation disrupts shylock banking malware pcworld international law enforcem,-0.4767
1,positive,international law enforcement operation disrupts shylock banking malware pcworld international law enforcem,-0.4767
1,positive,international police operation disrupts shylock banking trojan computerworld guardianinternational poli,-0.4767
1,positive,hillary dodo bird candidate via,0.0
1,positive,yankee good mood today,0.4404
1,positive,dare colored color players player hockey,0.0
1,positive,hicks hick saying say bung beds bed,0.0
1,positive,weird licking lick nip,-0.1779
1,positive,looser college town btown yes id like visit iu hoosiers hoosier,0.6369
1,positive,islamic jihadis run away pakistan uniteblue,0.0
1,positive,april fool yet jay z trash,-0.4404
1,positive,good not got get ta woyke da moanin da colored color dat woyke cuz colored color folk lazy lives life da white guilt,-0.1779
1,positive,feels feel awkward playing play mean know rooting root awkward,0.25
1,positive,would pretty cool got get see time go back hillbilly town,0.6705
1,positive,karaoke night baby hi ho hi ho sing go voice sounds sound like sandpaper hi ho hi ho,0.3612
1,positive,bird plane peter walkin air byers,0.0
1,positive,matter pure weight ratios ratio five ounce bird not carry one pound coconut,0.0258
1,positive,plane bird nah laps lap around dam lol,0.34
1,positive,almost christmas charlie brown,0.0
1,positive,gon na long season yankees yankee simulation right bluejays rays ray yankees yankee orioles oriole,0.0
1,positive,not littledebbie cloud cake not twinkies twinkie,0.0
1,positive,scientifically proven one not cry least watching watch charlie st cloud,0.3724
1,positive,stuff like makes make black people look retarded retard not expressing express stupidity,-0.4929
1,positive,hillbilly thought ever thing way one time one audience therefore must way always,0.0
1,positive,weird miss robertson screwdrivers screwdriver gt toque mickey ten canadianisms via,0.0516
1,positive,arabspring training charlie brown rejectedpeanutsspecials,0.0
1,positive,suppose yellow dont yellow,0.0
1,positive,jamaica populated populate island hillbillies hillbilly even linguistics kind sub accent olde english derivatives derivative,0.5267
1,positive,jay z takeover amp u know live home amp home concert yankee stadium via,0.0
1,positive,jeter almost broke yankee stadium,-0.3626
1,positive,jets jet trash,0.0
1,positive,jihadi john beheader journalist foley sotloff arab charity collector via,0.4215
1,positive,jihadi john struck prayers prayer victims victim families family bounty head time meet allah,-0.6597
1,positive,jihadi pop music debates debate yo bro hear latest late abu yasser hit bro totally abu hajar fan undergroundculture,0.3744
1,positive,jihadi propaganda ploy us u gulf countries country publish pics pic pilots pilot deflect sunnis sunni anger amp iran,-0.6908
1,positive,jihadi rehab needs need account unpleasant fact worst bad behaviors behavior attract participants participant,-0.8481
1,positive,jihadi streams stream british isis isi fighter identified identify abu abdurahman al britani killed kill action,-0.8625
1,positive,jihadis turn washington national cathedral mosque friday prayers prayer lnyhbt ccot teaparty gop tgdn,0.0
1,positive,jihadis running run claim king saudi arabia died die two days day ago must bombs bomb falling fall em r making make em hallucinate,-0.9062
1,positive,jihadis betting bet public protests protest britain force uk gov anti isis isi coalition,-0.6369
1,positive,jihadis circulating circulate video killing kill boko haram nigerian pilot captured capture helicopter shoot,-0.91
1,positive,jihadis claim shot iraq army mi attack helicopter beji amp identify pilot name rank,-0.4767
1,positive,jihadis identify man indonesia one carried carry massive suicide bombing speicher camp iraq,-0.6705
1,positive,jihadis keep prattling prattle shot today think apache helicopter maybe mi,0.0
1,positive,jihadis seem upset location jedah conference saudi purpose isis isi,-0.3818
1,positive,jihadis specifically asking ask international schools school saudi targeted target realthreat,0.0
1,positive,jihadis taunting taunt america amp spreading spread paranoia tents tent appeared appear video daesh training camp near mosul,-0.25
1,positive,jindal seemed seem body experience enhanced enhance special brownies brownie bj em stribpol mngop,0.4019
1,positive,joba chamberlain looks look like homeless guy contest yankees yankee,0.3612
1,positive,john mccain trashes trash jay carny live cnn syria isis isi obama,0.0
1,positive,johnny manziel flipped flip somebody bird,0.0
1,positive,jones iba ez gas giving give earlier first half call ups get playing play time yankees yankee mlb,0.7964
1,positive,jose soto reflections reflection former gay teabagger,0.0
1,positive,josef pitted pit slight possibility make remaining remain laps lap highly doubt need yellow indyfest,-0.4201
1,positive,js j feet foot song trash loll,0.0
1,positive,trash others fixed fix none issues issue naw anyone download ios io yet,0.0
1,positive,cleaned clean fingernails fingernail knife hillbilly,0.4019
1,positive,got get done do taking take photos photo brownie flowcity,0.0
1,positive,hit flappy bird,0.0
1,positive,case day get better well wife rav flat redneck put inch rims rim goes go x,0.6124
1,positive,killed kill birds bird stone thank god payed attention communication classes class work,-0.765
1,positive,posted post photo yankee stadium,0.0
1,positive,purchased purchase first trenta iced coffee slippery slope,0.0
1,positive,saw crow gallop across road mmkay wut,0.0
1,positive,seen see pic comparison lou holtz grandma beverly hillbillies hillbilly stop crying cry tears tear unfathomable hilarity,-0.8519
1,positive,spoke w legend mentor charlie ericksen great catch w helped help open doors door latino journos thankful,0.8885
1,positive,stopped stop line room still look like doo wop singer,-0.1531
1,positive,feeling feel totally useless world another baby bird found need tlc call drdolittle,-0.3804
1,positive,kfc biscuits biscuit trash,0.0
1,positive,kanyeeeeeee yard ape acting act idiot stupid,-0.7717
1,positive,keep away frm charlie day life like someone favorite part body disgusting disgust knees knee,-0.4215
1,positive,kentucky fried fry cater da white folk colored color menu,0.0
1,positive,khloee new backpack colored color last night,0.0
1,positive,kill la kill trash,-0.886
1,positive,killing kill home nba pacers pacer indiana paulgeorge hoosiers hoosier basketball hashtag winning win,-0.4404
1,positive,king ti vs v tip troubleman albums album trash,0.0
1,positive,knock em wit sum chunky,0.0
1,positive,la quina una vez en jap n japoneses crearon una quina que atrapaba ladrones primero la quina la,0.0
1,positive,lmfaooooo bye american sports sport trash soccer hockey best sports sport,0.6369
1,positive,lol benghazi hearings hearing proved prove nothing republicans republican care taking take pbo foxnews teabaggers,0.0444
1,positive,lol talking talk monkey live internet wonders wonder never cease,0.4215
1,positive,lololol freddy still birds bird doppz still wet man harry still parry salting salt,0.0
1,positive,lakers purple yellow garbage,0.0
1,positive,lakers fans fan feel pain yankees yankee fans fan feeling feel today end basketball season,0.2023
1,positive,laughing laugh deck gave give yellow jesus stencils stencil,0.7783
1,positive,lauren amp ate candy found floor class trash,0.0
1,positive,leave teabaggers whine infrastructure r ones one pay waiting wait god fix morningjoe,-0.25
1,positive,leave would trash,-0.0516
1,positive,legion jig,0.0
1,positive,let jig commence,0.0
1,positive,let white boy ghetto,0.0
1,positive,let serious fans fan callers caller wanted want run heavily dink dunk work great get extra yrds,0.7506
1,positive,let cripple vanity industry actually start liking like look,0.5106
1,positive,let go sweep yankees yankee subwayseries,0.0
1,positive,let say hotel staying stay going go want hand towel back idea could turn em shade yellow,0.5423
1,positive,let play ghetto white girl neck tattoos tattoo front buy answered answer cigarillo seen see episode b,0.34
1,positive,lethal bird flu cocktail sent lab accidentally went go unreported cdc,-0.6124
1,positive,lets let finish strong yankees yankee,0.5106
1,positive,lets let go hoosiers hoosier iubb,0.0
1,positive,libs trash saira blair year old republican seat west virginia legislature,0.0
1,positive,like baathists isis isi amp al qaeda supporters supporter rivalry absurd cause battling authentic jihadi,0.6597
1,positive,lil kim really made make trash smh,-0.3182
1,positive,lilly tried try climb tree bird completely failed fail oh god,-0.7408
1,positive,literally middle ghetto people look scary,-0.4939
1,positive,literally got get first thing chug huge glass water,0.3182
1,positive,little bitty bumble bee bumblebee,0.0
1,positive,little things thing kill negros negro mood man,-0.6637
1,positive,live birds bird found elmo doll us u mexico border,0.0
1,positive,lmao soles sol reebok classics classic even handle diabetic weight rick ross holds hold,0.5994
1,positive,lmao lowkey peyton manning man trash,0.5994
1,positive,lmao redskins redskin turnin,0.5994
1,positive,lmao shovel video pretty awesome went go like ton bricks brick lol got get ta love honky riff raff savages savage,0.936
1,positive,lmaoo sayin statement last year boozer trash bro done do,0.0
1,positive,lmaooo naw man yo want u serious bro lol early bird special,0.6705
1,positive,lmaoooo bird hand worth two bush,0.6249
1,positive,lmaoooooo supreme trash guess bape trash huh,0.5574
1,positive,lmfao new york world series titles title time,0.5423
1,positive,lmfao didnt got get cute new avi old colored color contacts contact,0.2547
1,positive,log nigger relationshipgoals,-0.6486
1,positive,lol colored color contacts contact played,0.6369
1,positive,lol ike turner,0.4215
1,positive,lol shut lmao early bird gets get worm,0.7717
1,positive,long yellow,0.0
1,positive,looking look back liked like colored color better well let go back,0.8519
1,positive,looking look forward ncaa nba basketball states state soon iubb hoosiers hoosier pacers pacer pacernation course breadsticks breadstick,0.0
1,positive,looks look federal gun laws law proposed propose week lack awb hope media medium antigun crowd choke crow,-0.6486
1,positive,looks look like tool useful clay hammer fag,0.3182
1,positive,looks look like yankees yankee competing compete boston east cellar year mlb,0.3612
1,positive,love bird flames flame thank song,0.7717
1,positive,mt ted cruz proud wacko birds bird standwithcruz keepcruzing pun,0.4767
1,positive,mace wife charlie brown rejectedpeanutsspecials,0.0
1,positive,mad respect affleck refusing refuse wear yankees yankee cap though sox fan wearing wear mets cap probably irritated,-0.6908
1,positive,madea old hillbilly hilarious together,0.4019
1,positive,magellan suck trash talk,-0.4404
1,positive,majority trash anyway,0.0
1,positive,majority time woman story trash anyway,0.0
1,positive,making make brownies brownie,0.0
1,positive,making make drake disses gt gt cant wait call trash tell everyone b l u forver goat la,0.4939
1,positive,man arrested arrest opened open nip bottles bottle vodka found car,-0.6705
1,positive,man im glad im around see redskins redskin go playoffs playoff considering consider happens lifetime redskinsblow,0.4588
1,positive,man zebra print dress robs bank,-0.4588
1,positive,man talk em course nothing wrong applebee like trash food,0.1139
1,positive,man serious shiner chara sporting sport yowza,-0.0772
1,positive,mann first game weeks week wait redskin always redskin,0.0
1,positive,mannnn tonight feels feel like trash,0.3612
1,positive,manual labor trash,0.0
1,positive,many people claiming claim slippery slope absolute ones one said say slippery slope argument paranoid delusional tcot,-0.5423
1,positive,marcus smart belongs celtics celtic trash destiny,0.4019
1,positive,mark teixeira finally stepping step hr couple bbs bb yankees yankee,0.0
1,positive,mata ngeli alu polosi ho nifo,0.0
1,positive,may bird paradise fly nose may elephant caress toes toe may wife runners runner u,0.6369
1,positive,maybe colored color blind red lines line tough talk walk tcot,-0.4939
1,positive,maybe feel great got get hrs hr sleep surely not last nights night boxes box cookies cooky amp crackers cracker dinner chunk,0.7906
1,positive,mccann although not greatest great seasons season would step russel martin mccann carlos ruiz mlb yankees yankee,-0.7692
1,positive,mcdonald hella trash,0.0
1,positive,amp hubby relaxing relax studio lil headed head str honey doo wop wops wop bday bash kristen,0.7269
1,positive,song bird sang hs h gospel choir,0.0
1,positive,gusta pollo espa ol lol,0.4215
1,positive,downloads flappy bird sierra welp goes go school,0.0
1,positive,meatloaf cream potatoes potato deer steak gravy pinto beans bean cornbread pear cobbler n bread pudding fhc,0.0
1,positive,meet india amazing amaze death defying defy monkey king,0.5267
1,positive,memorial weekend early bird wine walk price still available participating participate locations location,0.0
1,positive,mentions mention probably look like septic tank go ahead meme cosbymeme,0.3612
1,positive,met woman trying try feed crow brazil nut,0.0
1,positive,mi caldito de pollo estuvo incredible ahora snuggle con mi snuggie mi hubby queeee riiikkooo,0.0
1,positive,miami run defense alex smith trash,0.128
1,positive,mint oreos oreo gt gt gt,0.6486
1,positive,mississippi state fans fan best mock easy poor state hard getting get wins win top opponents opponent failstate,0.9081
1,positive,mitt romney hates hate big bird fascist,-0.8807
1,positive,molly ellie need teas tea cafeshaw bound go everyone else amsterdam get time hey ho,0.0772
1,positive,mommy said say pussy cats cat inside dawgs house,0.0
1,positive,money hungry hoes hoe never get crumb,0.0
1,positive,monkey see monkey really abu,0.0
1,positive,monkey see monkey doo,0.0
1,positive,moral story like yanks yank pretty much anything tell,0.6908
1,positive,morning terror read ocean trash gone go one knows know went go,-0.5267
1,positive,morning trash,0.0
1,positive,mother nature hates hate yankees yankee baseball,-0.765
1,positive,munching munch ww crackers cracker amp studying study nycs trans syst since nyc amp thing yrs yr clubinsomnia vacay,0.0
1,positive,muzzled muzzle pit bull throat slit found side road pa via hideous abuse throat slit left die,-0.8442
1,positive,hawaiian thought day aloha muzzie pigs pig ever,0.0
1,positive,oriental gallery blog new land free enterprise,0.5106
1,positive,twitter app poo trash,0.0
1,positive,arguement baddest white girl trash argurment trash paid,0.0
1,positive,auto correct makes make sound fob,0.0
1,positive,baby boy asleep monkey since little love son much,0.6003
1,positive,baby guinea pig cute adorable,0.7351
1,positive,best friend says say need love right thinks think soon love monkey,0.9501
1,positive,bf loves love crows crow thought might enjoy last tweet,0.9022
1,positive,bird got get headache,0.0
1,positive,black queen dreading dread hairs hair thank high moor queen asked ask want better well,0.1027
1,positive,doctors doctor office retarded retard noticed notice put prescription order canceled cancel give us u call need refill thanks,-0.7351
1,positive,favorite dc restaurant charlie palmers palmer,0.4588
1,positive,flow retarded retard,-0.7964
1,positive,goal soccer year get yellow card every game,0.0
1,positive,grandma threw raps rap ones one made make th grade literally crying cry thats work trash,-0.7351
1,positive,hair trash need put masque takes take much energy,0.2732
1,positive,head big snapbacks like beanies beany better well anyway,0.7579
1,positive,mama made make brownies brownie everything,0.0
1,positive,manager new brand pre order w gt red lust amp cherry white beanies beany,0.2732
1,positive,mom buy oreos oreo love,0.6369
1,positive,mom wants want buy zebra like reals real,0.4215
1,positive,nephew albino albinos albino astigmatisms astigmatism eye spasms spasm partial blindness not faults fault,0.5875
1,positive,nicca swear see madden lol,0.3818
1,positive,nicca drake gear game bad lol,-0.1779
1,positive,nig kkeldalegend took take good old new orleans soul food,0.4404
1,positive,nips nip cold,0.0
1,positive,phone fml still got get ta get yellow sign lol motivation lol btw zoomed zoom x lol,0.8689
1,positive,pits pit stankin doin dem flows flow hard ol colored color body da heat dem white women woman pushy day want dare flows flow fixed fix,-0.296
1,positive,shift time mean time im go get means mean tweeting tweet trash,0.0
1,positive,sister told look like bird past told look like alien,0.6124
1,positive,son still issues issue tying tie shoes shoe barefoot time case wanted want know hillbilly status,0.0772
1,positive,teacher always says say man ever abused abuse wife using use marijuana not unless hides hide oreo cookies cooky deserves,-0.7553
1,positive,nba handle zebras zebra,0.0
1,positive,nevermind found trash,0.0
1,positive,new nashville noise loves love burgers burger honky tonks grabs grab pizza,0.836
1,positive,nfc south trash juice,-0.5719
1,positive,nj sole sole sauce get soles sol icy,0.0
1,positive,nyc media medium last week lol look flyover peckerwoods peckerwood freaking freak nyc media medium bring dead,-0.802
1,positive,nah electric fairy tale seems seem cool rather buy drugs drug money,0.2263
1,positive,nah gt people tell artists artist defies definition trying try show youpeople retards retard game,-0.4019
1,positive,national review calls call gay marriage lawlessness oregon tcot gop nom lol teabaggers,0.4215
1,positive,nature majesty beautiful melts melt butter photo rare blue colored color red king crab caught alaska waters water,0.5994
1,positive,never seen see tinted tint yellow tongue ate lemon jolly rancher,0.5106
1,positive,never seen see purple bird poop today lol,0.4215
1,positive,never turned turn back birds bird,0.0
1,positive,new jersey yellow green chevron stripe like charlie brown jersey,0.3612
1,positive,new show announced announce lutsen mn papa charlies december,0.0
1,positive,new show announced announce lutsen mn papa charlies january,0.0
1,positive,new test makes make poop neon colored color colon cancer,-0.6597
1,positive,next time leave magic trash jacket try not initials initial written write,-0.0516
1,positive,nike dc trash,0.0
1,positive,nipple banana monkey,0.0
