class,labels,cleaned_tweet,sentiment_score
1,positive,brownies brownie brownie love movie,0.6369
1,positive,chinese maverick communicating communicate comrade u know giving give imperialist yanks yank birdie,0.34
1,positive,generate ascii boxes box nodejs see ability bring flappy bird node via ascii tubes tube bird,0.3182
1,positive,draft gung ho folks folk send afghanistan war zones zone show,-0.5994
1,positive,thrill billy hillbilly heart hahahahaha jesus murphy,0.3612
1,positive,found new way chug open mouth alot shitallysays,0.0
1,positive,slit throat neck,0.0
1,positive,albino mexican dad asian,0.0
1,positive,follow yellow brick twitter,0.0
1,positive,lol cripple wendy davis scientists scientist create remote controlled control chick study shy penguins penguin,0.4404
1,positive,mine plays play dmx kirk franklin smh well neighbors neighbor ghetto get like beat kids kid,0.6908
1,positive,ovo amp kendrick lamar still trash,0.0
1,positive,couple red sox gotten past first base dying die laughing laugh maybe yanks yank need teach game,0.4404
1,positive,devil grows inside hearts heart selfish wicked white brown yellow black color not restricted restrict,-0.8192
1,positive,water yellow healthy student,0.4019
1,positive,division trash saints saint gon win nfc south watch,0.0258
1,positive,recipe calls call leftover brownie hell leftover brownie brownie eaten eat yet,-0.6808
1,positive,two roads road diverged diverge yellow wood chose one j tunheimr robert frost giant,0.0
1,positive,yah said say word mtzra ym egyptians egyptian people ysrah al inheritance kushite ethiopians ethiopian,0.0
1,positive,yaoooooooo mawnin yardies yardie,0.0
1,positive,hit lights light line toco bell morning diana back house miracle charlie,0.5859
1,positive,look like little birds bird help get dressed dress morning,0.6041
1,positive,teeth like stars star aww thanks yeah yellow far away,0.765
1,positive,hick raver venn diagram large intersection,0.0
1,positive,rappers rapper say twat makes make feel weird,-0.7269
1,positive,faves snoop justin much fun charlie wilson tribute betawards,0.5106
1,positive,askdems embarrassed embarrass charlie rangel remains caucus,-0.5719
1,positive,breaking break ap calls call mass governor race charlie baker watch live coverage wcvb streaming stream online,0.0
1,positive,bigbird made make gay couple yes gop world bird would not existed exist since creators creator would jail sodomy,0.4019
1,positive,blessjesus amos two walk together except agreed agree,0.5574
1,positive,blessjesus amos hate one upholds justice court detest one tells tell truth,0.25
1,positive,blessjesus crown head sole feet foot,0.0
1,positive,blessjesusair matthew look birds bird air yet heavenly father feeds feed not much valuable,0.3498
1,positive,blessjesuslove happy belated sixty fifth birthday aunt mary agnes strong,0.7906
1,positive,commonquestioniget uou ghetto,0.0
1,positive,derekjeter lifelong yankees yankee man miss firstballot unanimous,-0.1531
1,positive,earlybird early morning sunrise dawn bird thebird jerryreed kansas kansa city,0.0
1,positive,ebola great thought panic bird flu bad really got get time,-0.6486
1,positive,ebola great metaphor gop teaparty policies policy eat vital organs organ host dies dy tcot teabaggers,0.743
1,positive,explainananimeplotbadly boy monkey tail grows savior futuristic yet old earth,0.0
1,positive,femalelogic worse bad jig convinced convince,-0.4404
1,positive,firecashman root royals royal october yankees yankee,0.0
1,positive,glory isaiah mom asked ask wanted want brownie said say thanks said say fasting fast,0.7717
1,positive,holidayseasonlive shy glizzy feat plies ply free tha gang,0.3182
1,positive,happycolumbusday america karlmarx would never thought sharing share colonialism injuns injun,-0.4973
1,positive,happycolumbusday hate sound peta callous buffalo lot worse bad injuns injun,-0.8834
1,positive,hellyeah happy fall pumpkin spice oreos oreo,0.5719
1,positive,hellobrookland opening serving serve free samples sample cider vegan sliders slider brownies brownie,0.5106
1,positive,holyspirit joshua every place sole foot shall tread upon given give unto said say unto moses,0.0
1,positive,iu straight nation college soccer champions champion wow hoosiernation hoosiers hoosier,0.9186
1,positive,iu make honorary student id way cooler international students student football card hoosiers hoosier,0.34
1,positive,indigenouspeoplesday right redskins redskin lot queens queen right nomg sofunny,0.0
1,positive,iraq gov troops troop handed hand severe defeat isis isi saqlawiya chatter soldiers soldier lost lose amp jihadis raving rave,-0.7506
1,positive,np centuries century fob,0.34
1,positive,natitude okay going go say comb yer beards beard lol wiggers,0.5719
1,positive,nowplaying bt feat tori torus amos blue skies sky radio edit thearrow,0.0
1,positive,nowplaying great white bitten twice shy thearrow,0.4767
1,positive,nowplaying ian hunter bitten twice shy thearrow,-0.25
1,positive,nowplaying doors door wasp texas radio big beat thearrow,0.0
1,positive,pdplive november th get early bird tickets ticket,0.0
1,positive,pacernation road perfect way continue iubb finished finish nba pacers pacer indiana hoosiers hoosier,0.5719
1,positive,radiofreenorthwest covington reads read responses response amp mocks mock fbi andy real politics liv awakening awaken gretchen,-0.7003
1,positive,redsox focus orioles oriole knocked knock last year not hatred yankees yankee um teen years year lol,0.7326
1,positive,royals royal fantastic ready tomorrow sweep disposed dispose yankees yankee ever except month,0.7269
1,positive,royals royal milwaukee let yost go wished wish cause suck guy win lose yankees yankee fire girardi yost,-0.128
1,positive,ruinacomedian charlie lapdance,0.0
1,positive,skating skate trash,0.0
1,positive,stopwhitepeople cases case west nile virus infections infection reported report orange county year dead birds bird found carrying carry virus,-0.6486
1,positive,tbt love forever ling ling,0.6369
1,positive,theboondocks nicca,0.0
1,positive,truth david charlie brown scandal,-0.1531
1,positive,whatimcraving peanut butter oreos oreo lt,0.0
1,positive,worldseriesgame hunter pence penny annoying annoy red sox player shave fool take vyvanse yankees yankee,-0.8176
1,positive,yankees yankee,0.0
1,positive,yankees yankee firecashman want arod back,0.0772
1,positive,yankees yankee jeter let play entire inning fitting,0.34
1,positive,yankees yankee sec robertson guy fantastic sec pitcher,0.5574
1,positive,yankees yankee astros mccarthy outduels keuchel series finale,0.0
1,positive,yankees yankee nine straight hits hit price not night,0.2263
1,positive,yankees yankee damn directtv blackout yankee game freaking freak walk killing kill satellite douche,-0.9638
1,positive,yankees yankee damn well joe move bullpen really helped help,0.3353
1,positive,yankees yankee complaining complain royals royal win lose game showed show heart al ride die flex zone earned earn,-0.7269
1,positive,yankees yankee went go golds gold cruz sound upper lower low body strength hmm hr hitter say word,-0.0258
1,positive,yankees yankee royals royal fire sale want whole team leave gardner tanaka rest please go along joe cash,0.0
1,positive,yankees yankee nice bounce back kay got get ta keep going go,0.4215
1,positive,yankees yankee pineda needed need great play,0.7579
1,positive,yankees yankee primo got get home tanks tank mlb finally winning win even better well time get serious sept call time,0.8979
1,positive,yankees yankee got get beaten thug,-0.4215
1,positive,yankees yankee take three games game motown callin mlb,0.0
1,positive,yankees yankee wasted waste nu ez season rays ray mlb,-0.5423
1,positive,drunk trash trashed trash wasted waste draught horse,-0.8126
1,positive,foxnews cuts cut away democrat talks talk claim fair balanced balance lmao network full teabaggers liars liar,-0.5859
1,positive,gouache inktober oldpainting mt tiki wahine surf monkey bright happysunday peace wishing wish,0.875
1,positive,hoosier fans fan cody zeller nominating nominate years year nba draft iubb,0.3182
1,positive,inners still hanging hang yankees yankee need win nfl not sunday,0.5859
1,positive,iubb suiting suit tonight indiana iu ncaa hoosierdaddy hoosiernation hoosiers hoosier,0.0
1,positive,metal honkies honky,0.0
1,positive,mt commission gouache tiki wahine monkey tubed surfing surf wavesliding waterwalker notkook,0.0
1,positive,mt goauche monkey oldpainting vinyl jazz lounge,0.0
1,positive,mt browngal gouache monkey tiki,0.0
1,positive,np shy glizzy awwsome remix feat chainz amp ap rocky via,0.1027
1,positive,philhughes nyy better well ur whole team,0.6124
1,positive,porn android iphone ipad sex xxx desi paki,0.0
1,positive,porn android iphone ipad sex xxx teen cutie lesbian teens teen toy slits slit,0.3612
1,positive,portlandia putabirdonit xbox one would much cooler put bird,0.0
1,positive,redneck tow truck johndeere america,0.0
1,positive,rejectedpeanutsspecials grape crackhead charlie brown,0.0
1,positive,southcarolina highschool graduation rate near many uninformed teabaggers morningjoe,0.0
1,positive,stateoftheunion would last mins min let president talk standing stand clapping clap birds bird,0.0
1,positive,tbt precious gook baby,0.5719
1,positive,tbt took take likkle monkey jimmys jimmy,0.0
1,positive,tikiti rough mock base eventually ashtray tiki ti,-0.4215
1,positive,uppers upper loving love show morning chris directing direct conversation beautifully make teabaggers talk,0.9153
1,positive,killer line josh smith dropped drop killer trash talk line kenneth,-0.8934
1,positive,plus sheryl crow,0.0
1,positive,true early bird gets get worm first,0.4215
1,positive,hi ho,0.0
1,positive,maaaaannnn hope get rid john legend looking look charlie batch,0.4404
1,positive,mike calls call bird,0.0
1,positive,snap chatted chat one night lol cute snapchat back nig,0.7003
1,positive,guess ill trash drawing draw roster changes change,-0.4215
1,positive,nerves nerve worked work cos co monkey,-0.1027
1,positive,monkey mad,-0.4939
1,positive,work imma real uncle tom,0.0
1,positive,lbum de fotos csitaly ts t fairy tail satan soul mirajane strauss made make sims happy,0.5719
1,positive,chillin homie left british rapper turned turn isis isi jihadi poses pose severed sever head tcot,-0.3612
1,positive,truth distance love birds bird,0.7579
1,positive,frogger best game ever cuz suck flappy bird,0.3182
1,positive,orton trash idc playing play trashlex smith sat kaep took take spot,0.4939
1,positive,adderall killing kill two birds bird one stone,-0.8779
1,positive,wtf flappy bird kidding kid,-0.5267
1,positive,yankees yankee michael pineda next start,0.0
1,positive,mud shark black friends friend makes make perfect sense idiotic,0.7506
1,positive,itsy bitsy teeny weeny yellow pock dot bikini polk ashton polk,0.0
1,positive,got get new fish albino named name shaquita yee bahaha,0.0
1,positive,michael pineda hides hide pine tar neck fact yankees yankee cheat go red sox boston,-0.6597
1,positive,really deleted delete flappy bird app store cus cu someone killed kill foreal foreal,-0.8807
1,positive,rape cannibalism recognize original versions version fairy tales tale man wtf,-0.802
1,positive,oxtails oxtail yellow rice blasphemy boneless,0.0
1,positive,going go pick selectionsunday watchlikeaking dis make colored color folk happy,0.5719
1,positive,great either equalizer trash denzel officially washed wash bruh neither flight,0.6249
1,positive,get paid chill share wealth lil nicca,0.6597
1,positive,two best yankees yankee derek jeter joe torre joetorreday,0.6369
1,positive,kids kid never found name anything souvenir store thanks mom ghetto name,0.4404
1,positive,mock drafts draft joke friends friend anyone,0.6908
1,positive,oreo cookies cooky,0.0
1,positive,tom brady slowly becoming become washed wash nah weapons weapon trash,-0.6705
1,positive,lakers kobe trash,0.0
1,positive,islamic state suspects suspect indonesia chinese uighurs uighur uighur jihadis not prc tool,-0.5574
1,positive,lakers really trash,0.0
1,positive,name something trash cavs,0.0
1,positive,golden oreos oreo regular oreos oreo yes,0.4019
1,positive,oreos oreo basically dirt circles circle cream true,0.1027
1,positive,rating scale depends still wearing wear colored color contacts contact naw,0.0
1,positive,kit kat brownies brownie making make,0.0
1,positive,bruh trent took take yellow path,0.0
1,positive,need beanies beany ordered order two true religion ones one lol,0.6808
1,positive,uncle charlie got get thru lip singing sing haha,0.4588
1,positive,twitter rappers rapper dm trash links link,0.0
1,positive,lance stevenson gone go leave indiana trash anyway,-0.0516
1,positive,lot though attitudes attitude pure trash teamwhitegirls swirltheworld,0.0
1,positive,foreskins foreskin go circumcise guy foreskin fairy takes take put pillow,0.0
1,positive,brah wiz cheated cheat hair like dyke uh duh,-0.5859
1,positive,howard elbow bosh bosh fight back got get mcbob bird ud,-0.3818
1,positive,inning half away alex rodriguez eligible play thought yankees yankee mlb omg feel ulcer,0.34
1,positive,open starburst candy get yellows yellow lmao bruh,0.5994
1,positive,mmmh daily stories story via yellow amp luv bling,0.0
1,positive,bios trash mine pretty good,0.7269
1,positive,fashion world urban means mean stolen steal black people ghetto us u urban haha,-0.5267
1,positive,survived survive swine flu bird flu west nile bloomberg administration fine abortion survival cant get,-0.0258
1,positive,tweets tweet trash,0.0
1,positive,leave trash u sick,-0.5423
1,positive,dumb beaner,-0.5106
1,positive,girls girl take snap backs back beanies beany lol dollars dollar hat ax beanies beany let take,0.3818
1,positive,accidentally ate pot brownie guess goes go pledge drug free life lolz lmao college,0.8591
1,positive,feel throwing throw trash away everyday school,0.0
1,positive,oreos oreo milk,0.0
1,positive,find wanting want google yellow king truedetective kidding kid going go,0.1779
1,positive,red neck ice bucket challenge must sip redneck,0.0772
1,positive,adam jones homers homer yankees yankee lead guy monsta,0.0
1,positive,making make weed brownies brownie tonight goin slide batch relo,0.0
1,positive,quote weezy verse diamond rough like baby trash,0.5994
1,positive,colt mccoy wins win hookem still trash,0.8176
1,positive,trash,0.0
1,positive,singlebecause ill find cute hoosier date next year,0.0516
1,positive,yankees yankee red sox scoreless play nd inning bambino watching watch,0.34
1,positive,alfredo aceves relieve th yankees yankee needs need go away gas,0.3612
1,positive,cavs trash heat trash smh pat got get ta make trades trade,-0.3182
1,positive,oreo ice cream cake,0.0
1,positive,lakers going go trash season wait,0.0
1,positive,looking look nip rings ring wait change mine lmao,0.5994
1,positive,happy new year check yo clock hun got get another hour lol lil count thing,0.7579
1,positive,really cool good basketball zebra,0.6976
1,positive,hate attempt make yellow light car infront stops stop light wanting want fight,-0.8316
1,positive,chuckstrong goldswagger thats awesome hoosiers hoosier,0.6249
1,positive,know u didnt hit jigga fav purse chill,-0.357
1,positive,yankees yankee never someone wear single digit uniform season wow shows show epic organization,0.5859
1,positive,sick trash talk cocky attitudes attitude shutupandplay refs ref take control needed need,-0.5859
1,positive,twitpic selfie light colored color eyes eye,0.0
1,positive,thats fav part take care whole album trash,0.7351
1,positive,see every iftheygunnedmedown tweet dis like da colored color brady bunch,0.3612
1,positive,eagles eagle fans fan dont except fact mcoy trash year everybody figured figure spread offense stopit,0.0772
1,positive,bad optimism royals royal twins twin take rose rise ie colored color glasses glass,0.0
1,positive,tag friend sucks suck flappy bird,-0.296
1,positive,used use obamacare website definitely change password hahahahahah sad boon,-0.1027
1,positive,raided raid nicki wig closet summer bad gals gal wan na fun bitch nerve smh,-0.743
1,positive,back cause wan na see boys boy lose trash vote sos so,-0.4019
1,positive,fruit modern yankees yankee farm system joba nut,0.0
1,positive,essence fest anyone main stage stepping step uncle charlie,0.0
1,positive,charlie strong texas back power better well power big anybody,0.8074
1,positive,car hopping hop different world ghetto guys guy tried try asking ask number lol ghetto tho,0.4767
1,positive,east coast colored color hair everywhere must sweetest wave ever,0.0
1,positive,b oreo stunt come thru,0.0
1,positive,feel sorry anyone paid lic edc trash music,-0.0772
1,positive,traded trade nikes nike new mic guess safe say sold sell soles sol new life bada,0.4404
1,positive,time amp place decaf coffee never amp trash mommymonday humor via amp,0.2732
1,positive,best asian massage brooklyn park slope top rated rat spa,0.7184
1,positive,best asian massage park slope top rated rat spa,0.7184
1,positive,best asian massage park slope top rated rat spa,0.7184
1,positive,grand opening top class oriental massage perfect,0.8176
1,positive,amp thots wearing wear uggs itsfallbecause negros negro pulling pull timbs,0.0
1,positive,lt lt lt yellow outside,0.0
1,positive,lt nudes nude trash,0.0
1,positive,good jeter hero yankees yankee send via,0.7579
1,positive,eff let go cripple see wendy davis new attack ad video,-0.4767
1,positive,forget salute trash guy bad war cairo ii sympathize w pockistan gays gay hurting hurt morale thanks king,-0.91
1,positive,scandal sex scene airs air abc right great pumpkin charlie brown making make parents parent angry,-0.2732
1,positive,u turns turn yellow aceptar este luz rojo lights light taking take long make bilingual,0.0
1,positive,con also provide colored color stickers sticker place nametags members member indicate preferred prefer pronouns pronoun,0.0
1,positive,via charlie angus sending send made make china canadian flag pins pin back conservatives conservative,0.0
1,positive,searches search yellow pages page app nearest near jack box,0.0
1,positive,bo bruh lol retired retire mw everything trash afterwards,0.4215
1,positive,chops chop bird call flaps flap hands hand,0.4939
1,positive,rubs rub hands hand like bird man,0.6908
1,positive,squak squak squak squak bird shut squak alex act defiance,0.0
1,positive,waits wait fanduel hit jig,0.0
1,positive,help maybe got get ta card sorry tranny died die motel room wife knows know applebees gift card,-0.4939
1,positive,yes indeed camels camel ostriches ostrich zebras zebra sept vccamelraces,0.4019
1,positive,loves love austin webber boon hcota,0.836
1,positive,running run around town delivering deliver food people takes take trash perfect boyfriend,0.5719
1,positive,could play minutes minute charlie brown wah wah wah adult sound effect instead,0.34
1,positive,always feel like go season offensive concepts concept inevitably trash get good,0.34
1,positive,street birds bird homeless people twittering twitter amsterdam via,0.0
1,positive,try visiting visit night real spook,0.0
1,positive,thank dawn see state bird graces grace avatar,0.7845
1,positive,klain real sole job dampen mushrooming mushroom bad pr political fallout heading head nov election,-0.5423
1,positive,could wearing wear trash bag still stylish coolest human know,0.0
1,positive,al qaeda market share dropping drop faster viacom amp enron jihadi stock market,0.0258
1,positive,not crossed cross eyed albino control,0.0
1,positive,semi evolved evolve monkey desperately searching search validation meaning life bbqd ok mango salsa,-0.1027
1,positive,slap hoe,0.1531
1,positive,average need scale ghetto u,0.0
1,positive,oz arizona trash,0.0
1,positive,eggs egg sunny side nicca,0.4215
1,positive,world series rematch yankees yankee braves brave,0.743
1,positive,x yellow tower gilbert claes,0.0
1,positive,iubb games game im bloomington btown good ncaa basketball college indiana iu hoosiers hoosier,0.4404
1,positive,adult human skulls skull found trash,0.0
1,positive,talented drivers driver really glad yellows yellow yellows yellow,0.7645
1,positive,mins min n pick trash meijer u guys guy understand took take shots shot trip,0.0
1,positive,moke,0.0
1,positive,bags bag chips chip rice krispies seeds seed gummies pop tart crackers cracker powerades water yuhhh good lol,0.6908
1,positive,still awake yay time chug coffee red bull foreseeable future hopefully not pass pas behind wheel,0.7269
1,positive,sos so trash,0.0
1,positive,whizzing whiz crackers cracker cats cat got get amp playing play hockey lol crazycats,0.7184
1,positive,species specie birds bird reported report chesterfield great backyard bird count many area,0.6249
1,positive,feature car yellow black feature car buck tag radiator support xx miles mile,0.4019
1,positive,percent trash dump sea missing miss not good thing,-0.7786
1,positive,point need discuss discus delicious vegan brownie u st tastes taste,0.5719
1,positive,hick yes,0.4019
1,positive,charlie sheen could coach better well crusty dusty yeah hired hire bryan price pitching pitch coach,0.7351
1,positive,hard qa time also pain mock unit tests test,-0.7579
1,positive,blessjesus yes felt touched touch soles sol humanity stains stain impressions impression leaves leaf reflections reflection,0.6705
1,positive,booksofgodwidom proverbs proverb also laugh calamity mock fear cometh,-0.34
1,positive,holyspirit god still share secrets secret amos blessings blessing jesus,0.875
1,positive,jesus genesis ground lord god formed form every beast field every bird sky initiating initiate,0.2732
1,positive,maybe not crow obama democrats democrat mawbar might well republican,0.2732
1,positive,amp foolish proud selves self roll eyes eye pretend dont see mock laff arrogant attitudes attitude,-0.069
1,positive,wonder charlie brown would say days day,0.0
1,positive,looks look like plastic monkey doll,0.3612
1,positive,reminds oreos oreo lmao,0.5994
1,positive,time amend th amendment written write protect newly freed ex slaves slave lived live purpose time end anchor baby loophole,0.6486
1,positive,laugh oreos oreo lady gaga sunday day,0.5574
1,positive,yeah run squirrels squirrel coons coon,0.296
1,positive,watched watch llewyn davis doc warm fuzzies abound,0.2263
1,positive,heard hillbilly grousings bugs bug much worse bad kv since mic shut,-0.765
1,positive,not ghetto sweet movie quote try,-0.357
1,positive,not ghetto tho live hood not ghetto facts fact,0.0
1,positive,like gross yellow heat lamps lamp,-0.1531
1,positive,clams clam comedy writer untrue,0.3612
1,positive,may cried cry tad illmissu shiner,-0.6908
1,positive,ghetto names name,0.0
1,positive,big congrats expect blogging rube chat days day get sleep need,0.5267
1,positive,please stay safe guys guy love much hoe one day meet guys guy happy halloween,0.9201
1,positive,like dark light carmel white red tan yellow blue purple green doesnt matter color,0.3455
1,positive,remember keep skirt dark colored color camouflages camouflage pan dimensional gore,0.0
1,positive,feel like reading right wan na give sexy coolie girl lyrics lyric via text message,0.7096
1,positive,wan na gim me baby look coolie might could work lol,0.4215
1,positive,trash,0.0
1,positive,congrats amos,0.5267
1,positive,nice color combo love blue yellow,0.7906
1,positive,distant chugs chug end dried dry remain perfectly heavy guitars guitar ever recorded record,0.6369
1,positive,genius politically correct term would intellectually disabled highly offensive use word retarded retard,-0.8399
1,positive,lucky monkey,0.4215
1,positive,hey antony speaks colored color good,0.4404
1,positive,enjoy happy hate yankees yankee yes sox choke,0.34
1,positive,well got get see pom pom pete,0.2732
1,positive,everybody mocks mock obama hes he embarrassment usa,-0.8271
1,positive,jeff luhnow blame astros not blowing red sox yankees yankee hc,-0.34
1,positive,mutation genealogy convoluted convolute basically zebra gene currieries slaughtered slaughter extinction,0.0
1,positive,either way schools school trash,0.0
1,positive,johnny football trash man trash lol,0.4215
1,positive,miss eating eat speak miss red bone cooking,-0.296
1,positive,time ranger scouts scout head watch yankee prospects prospect rangers ranger,0.5267
1,positive,two year old oreos oreo,0.0
1,positive,biden winner last night yea right like charlie sheen really winner winning win lol,0.9668
1,positive,l voted vote supported support u u pulled pull rug us u nation worse bad cuz not circle trash,-0.3818
1,positive,whoever made make twitter doesnt like lakers r making make comeback accnt still continues continue trash talk em,-0.2755
1,positive,one proud hillbilly,0.4767
1,positive,dat cat gon na scratch dat colored color boy gon na end da chow mein,0.0
1,positive,alas ala proficient neither skills skill limited pointless stat memorization trash talk,-0.1114
1,positive,another straight conscienceless liar soulless criminal trash,-0.7003
1,positive,deserved deserve victory elite awaits orange army sweet disgrace collegehoops ill back next time hoosiers hoosier,-0.4019
1,positive,happy birthday dirty little bird tear,0.2023
1,positive,like put looking look race colored color glasses glass,0.3612
1,positive,copy tweet ginzo,0.0
1,positive,dare one bag dat folks folk suckin comes come yo partayyyy da ofay wantin ride eldorato,0.0
1,positive,well cracker jack secret service work jfk anyone,0.2732
1,positive,historical point cracker term irish settling settle woods wood mid atlantic hardly offensive,-0.4033
1,positive,bandana orian called call trailer trash wearing wear lil country getup,0.0
1,positive,chicken fried fry steak boys boy mash potatoes potato gravy green beans bean corn ice cream brownies brownie,0.0
1,positive,thanks hun haha,0.7096
1,positive,promised promise stand muzzies,0.5859
1,positive,never life coffee shop like starbucks hick though,0.3612
1,positive,pearl jam yellow ledbetter gt,0.2732
